{
  "$schema": "https://json-schema.org/draft/2020-12/schema",
  "$id": "https://sierracatalina.com/context-layer/schemas/0.3.0-draft.1/lifecycle-event.schema.json",
  "title": "lifecycle event",
  "description": "Content-free vault lifecycle record for sync. MUST NOT include claim text, selector values, or payloads. Distinct from a 0.2 receipt.",
  "type": "object",
  "additionalProperties": false,
  "required": [
    "spec_version",
    "type",
    "id",
    "created_at",
    "issuer",
    "subject_ref",
    "operation",
    "occurred_at",
    "refs",
    "payload_included"
  ],
  "properties": {
    "spec_version": {
      "const": "context-layer/0.3-draft"
    },
    "type": {
      "const": "lifecycle_event"
    },
    "id": {
      "type": "string",
      "pattern": "^urn:cl:lifecycle:[A-Za-z0-9._~-]+$"
    },
    "created_at": {
      "type": "string",
      "format": "date-time"
    },
    "issuer": {
      "$ref": "#/$defs/issuer"
    },
    "subject_ref": {
      "type": "string",
      "minLength": 3,
      "maxLength": 512
    },
    "operation": {
      "enum": [
        "pass.issued",
        "pass.revoked",
        "pairing.revoked",
        "proposal.committed",
        "bundle.issued",
        "bundle.expired"
      ]
    },
    "occurred_at": {
      "type": "string",
      "format": "date-time"
    },
    "refs": {
      "type": "object",
      "additionalProperties": false,
      "minProperties": 1,
      "properties": {
        "pass_ref": {
          "type": "string",
          "pattern": "^urn:cl:pass:[A-Za-z0-9._~-]+$"
        },
        "pairing_ref": {
          "type": "string",
          "pattern": "^urn:cl:pairing:[A-Za-z0-9._~-]+$"
        },
        "proposal_ref": {
          "type": "string",
          "pattern": "^urn:cl:proposal:[A-Za-z0-9._~-]+$"
        },
        "bundle_ref": {
          "type": "string",
          "pattern": "^urn:cl:bundle:[A-Za-z0-9._~-]+$"
        },
        "request_ref": {
          "type": "string",
          "pattern": "^urn:cl:request:[A-Za-z0-9._~-]+$"
        },
        "decision_ref": {
          "type": "string",
          "pattern": "^urn:cl:decision:[A-Za-z0-9._~-]+$"
        }
      }
    },
    "payload_included": {
      "const": false
    }
  },
  "allOf": [
    {
      "if": {
        "properties": {
          "operation": {
            "enum": [
              "pass.issued",
              "pass.revoked"
            ]
          }
        },
        "required": [
          "operation"
        ]
      },
      "then": {
        "properties": {
          "refs": {
            "required": [
              "pass_ref"
            ]
          }
        }
      }
    },
    {
      "if": {
        "properties": {
          "operation": {
            "const": "pairing.revoked"
          }
        },
        "required": [
          "operation"
        ]
      },
      "then": {
        "properties": {
          "refs": {
            "required": [
              "pairing_ref"
            ]
          }
        }
      }
    },
    {
      "if": {
        "properties": {
          "operation": {
            "const": "proposal.committed"
          }
        },
        "required": [
          "operation"
        ]
      },
      "then": {
        "properties": {
          "refs": {
            "required": [
              "proposal_ref"
            ]
          }
        }
      }
    },
    {
      "if": {
        "properties": {
          "operation": {
            "enum": [
              "bundle.issued",
              "bundle.expired"
            ]
          }
        },
        "required": [
          "operation"
        ]
      },
      "then": {
        "properties": {
          "refs": {
            "required": [
              "bundle_ref"
            ]
          }
        }
      }
    }
  ],
  "$defs": {
    "issuer": {
      "type": "object",
      "additionalProperties": false,
      "required": [
        "id"
      ],
      "properties": {
        "id": {
          "type": "string",
          "minLength": 3,
          "maxLength": 512
        }
      }
    }
  }
}
